{
  "$schema": "https://json-schema.org/draft/2020-12/schema",
  "title": "Phase-one community text submission",
  "type": "object",
  "additionalProperties": false,
  "required": [
    "version",
    "bot",
    "title",
    "body"
  ],
  "properties": {
    "version": {
      "const": 1,
      "type": "integer"
    },
    "bot": {
      "type": "string",
      "minLength": 1,
      "maxLength": 80
    },
    "title": {
      "type": "string",
      "minLength": 1,
      "maxLength": 120
    },
    "body": {
      "type": "string",
      "minLength": 1,
      "maxLength": 8000
    }
  },
  "$comment": "Proposed phase-one automated entry only; automation is not enabled. Other code works may be discussed in ordinary PRs. Duplicate keys, unsafe paths, executable modes and active-content checks require the trusted validator. This schema alone does not authorize merging."
}
